{
  "date": "2026-10-10",
  "n_feeds_total": 235,
  "n_stories_total": 0,
  "stories": [],
  "feeds": [
    {
      "name": "AFP / France 24 FR",
      "bucket": "france",
      "section": "news",
      "lang": "fr"
    },
    {
      "name": "Le Monde",
      "bucket": "france",
      "section": "news",
      "lang": "fr"
    },
    {
      "name": "Le Figaro",
      "bucket": "france",
      "section": "news",
      "lang": "fr"
    },
    {
      "name": "Le Parisien",
      "bucket": "france",
      "section": "news",
      "lang": "fr"
    },
    {
      "name": "BFM TV",
      "bucket": "france",
      "section": "news",
      "lang": "fr"
    },
    {
      "name": "France Info",
      "bucket": "france",
      "section": "news",
      "lang": "fr"
    },
    {
      "name": "Reuters (via Google News)",
      "bucket": "wire_services",
      "section": "news",
      "lang": "en"
    },
    {
      "name": "AP News",
      "bucket": "wire_services",
      "section": "news",
      "lang": "en"
    },
    {
      "name": "AFP / France 24 EN",
      "bucket": "wire_services",
      "section": "news",
      "lang": "en"
    },
    {
      "name": "Liberation",
      "bucket": "wire_services",
      "section": "news",
      "lang": "fr"
    },
    {
      "name": "CNN World",
      "bucket": "usa",
      "section": "news",
      "lang": "en"
    },
    {
      "name": "Fox News World",
      "bucket": "usa",
      "section": "news",
      "lang": "en"
    },
    {
      "name": "NPR World",
      "bucket": "usa",
      "section": "news",
      "lang": "en"
    },
    {
      "name": "Politico",
      "bucket": "usa",
      "section": "news",
      "lang": "en"
    },
    {
      "name": "Axios World",
      "bucket": "usa",
      "section": "news",
      "lang": "en"
    },
    {
      "name": "The Hill",
      "bucket": "usa",
      "section": "news",
      "lang": "en"
    },
    {
      "name": "Daily Wire",
      "bucket": "usa",
      "section": "news",
      "lang": "en"
    },
    {
      "name": "Breitbart",
      "bucket": "usa",
      "section": "news",
      "lang": "en"
    },
    {
      "name": "Daily Caller",
      "bucket": "usa",
      "section": "news",
      "lang": "en"
    },
    {
      "name": "Mother Jones",
      "bucket": "usa",
      "section": "news",
      "lang": "en"
    },
    {
      "name": "Defense News",
      "bucket": "usa",
      "section": "news",
      "lang": "en"
    },
    {
      "name": "War on the Rocks",
      "bucket": "usa",
      "section": "news",
      "lang": "en"
    },
    {
      "name": "ProPublica",
      "bucket": "usa",
      "section": "news",
      "lang": "en"
    },
    {
      "name": "The Intercept",
      "bucket": "usa",
      "section": "news",
      "lang": "en"
    },
    {
      "name": "Reason",
      "bucket": "usa",
      "section": "news",
      "lang": "en"
    },
    {
      "name": "BBC World",
      "bucket": "uk",
      "section": "news",
      "lang": "en"
    },
    {
      "name": "The Guardian World",
      "bucket": "uk",
      "section": "news",
      "lang": "en"
    },
    {
      "name": "The Telegraph",
      "bucket": "uk",
      "section": "news",
      "lang": "en"
    },
    {
      "name": "Daily Mail",
      "bucket": "uk",
      "section": "news",
      "lang": "en"
    },
    {
      "name": "Daily Mirror",
      "bucket": "uk",
      "section": "news",
      "lang": "en"
    },
    {
      "name": "Sky News UK",
      "bucket": "uk",
      "section": "news",
      "lang": "en"
    },
    {
      "name": "The Independent",
      "bucket": "uk",
      "section": "news",
      "lang": "en"
    },
    {
      "name": "i News",
      "bucket": "uk",
      "section": "news",
      "lang": "en"
    },
    {
      "name": "New Statesman",
      "bucket": "uk",
      "section": "news",
      "lang": "en"
    },
    {
      "name": "Tehran Times",
      "bucket": "iran_state",
      "section": "news",
      "lang": "en"
    },
    {
      "name": "IRNA English",
      "bucket": "iran_state",
      "section": "news",
      "lang": "en"
    },
    {
      "name": "IRNA Farsi",
      "bucket": "iran_state",
      "section": "news",
      "lang": "fa"
    },
    {
      "name": "Mehr News English (rsshub)",
      "bucket": "iran_state",
      "section": "news",
      "lang": "en"
    },
    {
      "name": "Kayhan (rsshub)",
      "bucket": "iran_state",
      "section": "news",
      "lang": "en"
    },
    {
      "name": "Iran International EN",
      "bucket": "iran_opposition",
      "section": "news",
      "lang": "en"
    },
    {
      "name": "Iran International FA",
      "bucket": "iran_opposition",
      "section": "news",
      "lang": "fa"
    },
    {
      "name": "RFE/RL (was Radio Farda)",
      "bucket": "iran_opposition",
      "section": "news",
      "lang": "en"
    },
    {
      "name": "Al Jazeera English",
      "bucket": "qatar",
      "section": "news",
      "lang": "en"
    },
    {
      "name": "Al Jazeera Arabic",
      "bucket": "qatar",
      "section": "news",
      "lang": "ar"
    },
    {
      "name": "CGTN Politics",
      "bucket": "china",
      "section": "news",
      "lang": "en"
    },
    {
      "name": "CGTN World",
      "bucket": "china",
      "section": "news",
      "lang": "en"
    },
    {
      "name": "Xinhua English",
      "bucket": "china",
      "section": "news",
      "lang": "en"
    },
    {
      "name": "Global Times",
      "bucket": "china",
      "section": "news",
      "lang": "en"
    },
    {
      "name": "People's Daily CN",
      "bucket": "china",
      "section": "news",
      "lang": "zh"
    },
    {
      "name": "Sixth Tone",
      "bucket": "china",
      "section": "news",
      "lang": "en"
    },
    {
      "name": "TASS English",
      "bucket": "russia",
      "section": "news",
      "lang": "en"
    },
    {
      "name": "RT",
      "bucket": "russia",
      "section": "news",
      "lang": "en"
    },
    {
      "name": "Moscow Times",
      "bucket": "russia",
      "section": "news",
      "lang": "en"
    },
    {
      "name": "Meduza",
      "bucket": "russia",
      "section": "news",
      "lang": "en"
    },
    {
      "name": "Times of India",
      "bucket": "india",
      "section": "news",
      "lang": "en"
    },
    {
      "name": "NDTV World",
      "bucket": "india",
      "section": "news",
      "lang": "en"
    },
    {
      "name": "The Hindu Intl",
      "bucket": "india",
      "section": "news",
      "lang": "en"
    },
    {
      "name": "Dainik Bhaskar",
      "bucket": "india",
      "section": "news",
      "lang": "hi"
    },
    {
      "name": "India Today",
      "bucket": "india",
      "section": "news",
      "lang": "en"
    },
    {
      "name": "Zee News",
      "bucket": "india",
      "section": "news",
      "lang": "en"
    },
    {
      "name": "OpIndia",
      "bucket": "india",
      "section": "news",
      "lang": "en"
    },
    {
      "name": "News18",
      "bucket": "india",
      "section": "news",
      "lang": "en"
    },
    {
      "name": "News18 India",
      "bucket": "india",
      "section": "news",
      "lang": "en"
    },
    {
      "name": "Times Now",
      "bucket": "india",
      "section": "news",
      "lang": "en"
    },
    {
      "name": "Republic World (alt)",
      "bucket": "india",
      "section": "news",
      "lang": "en"
    },
    {
      "name": "ABP Live",
      "bucket": "india",
      "section": "news",
      "lang": "en"
    },
    {
      "name": "Aaj Tak (alt)",
      "bucket": "india",
      "section": "news",
      "lang": "hi"
    },
    {
      "name": "Hindustan Times",
      "bucket": "india",
      "section": "news",
      "lang": "en"
    },
    {
      "name": "Firstpost",
      "bucket": "india",
      "section": "news",
      "lang": "en"
    },
    {
      "name": "Haaretz",
      "bucket": "israel",
      "section": "news",
      "lang": "en"
    },
    {
      "name": "Jerusalem Post",
      "bucket": "israel",
      "section": "news",
      "lang": "en"
    },
    {
      "name": "Times of Israel",
      "bucket": "israel",
      "section": "news",
      "lang": "en"
    },
    {
      "name": "Ynet Hebrew",
      "bucket": "israel",
      "section": "news",
      "lang": "he"
    },
    {
      "name": "Daily Sabah",
      "bucket": "turkey",
      "section": "news",
      "lang": "en"
    },
    {
      "name": "Hurriyet",
      "bucket": "turkey",
      "section": "news",
      "lang": "tr"
    },
    {
      "name": "Anadolu Agency English",
      "bucket": "turkey",
      "section": "news",
      "lang": "en"
    },
    {
      "name": "Bianet English",
      "bucket": "turkey",
      "section": "news",
      "lang": "en"
    },
    {
      "name": "Arab News",
      "bucket": "saudi_arabia",
      "section": "news",
      "lang": "en"
    },
    {
      "name": "Al Arabiya English",
      "bucket": "saudi_arabia",
      "section": "news",
      "lang": "en"
    },
    {
      "name": "Yonhap News",
      "bucket": "south_korea",
      "section": "news",
      "lang": "en"
    },
    {
      "name": "Korea Herald (via Google News)",
      "bucket": "south_korea",
      "section": "news",
      "lang": "en"
    },
    {
      "name": "Hankyoreh English",
      "bucket": "south_korea",
      "section": "news",
      "lang": "en"
    },
    {
      "name": "KBS World",
      "bucket": "south_korea",
      "section": "news",
      "lang": "en"
    },
    {
      "name": "Chosun Ilbo (alt)",
      "bucket": "south_korea",
      "section": "news",
      "lang": "ko"
    },
    {
      "name": "Yonhap Korean",
      "bucket": "south_korea",
      "section": "news",
      "lang": "ko"
    },
    {
      "name": "NHK Japanese",
      "bucket": "japan",
      "section": "news",
      "lang": "ja"
    },
    {
      "name": "Japan Times",
      "bucket": "japan",
      "section": "news",
      "lang": "en"
    },
    {